{"$schema":"https://json-schema.org/draft/2020-12/schema","type":"object","additionalProperties":false,"required":["schema_version","contains_raw_dataset","row_count","expected","observed","missing","unexpected","mismatch","duplicate","rows_sha256","files","merkle_root_sha256","manifest_sha256"],"properties":{"schema_version":{"type":"string","minLength":1},"contains_raw_dataset":{"const":false},"row_count":{"type":"integer","minimum":0},"expected":{"$ref":"#/$defs/triples"},"observed":{"$ref":"#/$defs/triples"},"missing":{"$ref":"#/$defs/triples"},"unexpected":{"$ref":"#/$defs/triples"},"mismatch":{"$ref":"#/$defs/triples"},"duplicate":{"$ref":"#/$defs/triples"},"rows_sha256":{"$ref":"#/$defs/sha256"},"files":{"type":"array","items":{"type":"object","additionalProperties":false,"required":["path","bytes","sha256"],"properties":{"path":{"type":"string","minLength":1,"pattern":"^(?!/)(?!.*(?:^|/)\\.\\.(?:/|$))(?!.*\\\\).+$"},"bytes":{"type":"integer","minimum":0},"sha256":{"$ref":"#/$defs/sha256"}}}},"merkle_root_sha256":{"$ref":"#/$defs/sha256"},"manifest_sha256":{"$ref":"#/$defs/sha256"}},"$defs":{"sha256":{"type":"string","pattern":"^[a-f0-9]{64}$"},"triple":{"type":"array","prefixItems":[{"type":"string","minLength":1},{"type":"string","minLength":1},{"type":"string","minLength":1}],"items":false,"minItems":3,"maxItems":3},"triples":{"type":"array","items":{"$ref":"#/$defs/triple"}}}}
