{"contains_raw_dataset":false,"duplicate":[],"expected":[["DEV-FIXTURE-BUNDLE-001","B0","613"],["DEV-FIXTURE-BUNDLE-001","B1","613"],["DEV-FIXTURE-BUNDLE-001","B2","613"],["DEV-FIXTURE-BUNDLE-001","B3","613"],["DEV-FIXTURE-BUNDLE-001","B4","613"],["DEV-FIXTURE-BUNDLE-001","B5","613"],["DEV-FIXTURE-BUNDLE-001","Proposed","613"]],"files":[{"bytes":11058,"path":"durable_rows.jsonl","sha256":"396faafc1dcbea236978162fd7c67ba9466c037f7375eb7d5d517bf609f22ab2"}],"manifest_sha256":"bda193f48d750cc49a3a5b47192312d655b392b2de5f1d4bb27381f74d9e8396","merkle_root_sha256":"4c647f52f1265980a9af0d1104c34f09a257f623a1e263d96c4c0c4330c8efae","mismatch":[],"missing":[],"observed":[["DEV-FIXTURE-BUNDLE-001","B0","613"],["DEV-FIXTURE-BUNDLE-001","B1","613"],["DEV-FIXTURE-BUNDLE-001","B2","613"],["DEV-FIXTURE-BUNDLE-001","B3","613"],["DEV-FIXTURE-BUNDLE-001","B4","613"],["DEV-FIXTURE-BUNDLE-001","B5","613"],["DEV-FIXTURE-BUNDLE-001","Proposed","613"]],"row_count":7,"rows_sha256":"396faafc1dcbea236978162fd7c67ba9466c037f7375eb7d5d517bf609f22ab2","schema_version":"1.0.0","unexpected":[]}
